702146,"г. Минск, ул. Народная, 12Б",,"M, V, L",,53.874162312,27.615824374
702148,"г. Минск, ул. Льва Сапеги, 5",,"M, V, L","M, V, L",53.87706961,27.484846366
702151,д. Тристенец СХП ЗАО Витекс,"M, V, L",,,53.52038889,27.52297222
702152,н.п. Спичник,"M, V, L",,,53.44294444,28.18952778
702153,"г. Минск, ул. Буденного, 1а",,"M, V, L","M, V, L",53.881725,27.607586111
702154,"г. Минск, ул. Переходная, 64",,"M, V, L","M, V, L",53.886813889,27.648844444
702155,"г. Жодино, ул. Рокоссовского, 11а",,"M, V, L","M, V, L",54.097166667,28.286833333
702161,"д. Зацень, ул. Луговая, 1а",,"M, V, L",,53.970055556,27.507555556
702168,"г. Минск, ул. Н. Орды, 25",,"M, V, L","M, V, L",53.8445839,27.482066608
702170,"г. Минск, ул. Кирова, 33",,"M, V, L",,53.899137112,27.563846729
702171,д. Ратомка,,"M, V, L","M, V, L",53.935388889,27.355166667
702172,"д. Колодищи, Волмянский шлях",,"M, V, L","M, V",53.951916667,27.80775
702178,"г. Минск, ул. Гаруна, 13, пом. 2",,"M, V, L","M, V, L",53.920735979,27.442516183
702180,"г. Минск, ул. Неманская, 14",,"M, V, L","M, V, L",53.9106181,27.4283528
702183,д. Заболотье,,"M, V, L","M, V, L",53.790166667,27.398216667
702186,д. Тарасово,,"M, V, L",,53.92425,27.390694444
702188,"г. Солигорск, ул. Судиловского",,"M, V, L","M, V, L",52.785944444,27.499305556
702194,"Колодищанский с/с, район аг. Колодищи",,"M, V, L","M, V, L",53.962527778,27.762527778
702196,"г. Борисов,  6 микрорайон (район пересечения ул. 50 лет БССР - кольцевая дорога)",,"M, V, L","M, V, L",54.216780556,28.468580556
702200,"г. Солигорск, ул. Ленинского Комсомола, д. 51",,"M, V, L","M, V, L",52.79795,27.537569444
702202,"г. Минск, ул. Болеслава Берута, 5",,"M, V, L","M, V, L",53.904311111,27.503786111
702206,"г. Минск, пр-т Рокоссовского, 89а",,"M, V, L","M, V, L",53.861555556,27.613611111
702207,"г. Минск, ул. Карбышева, 7/2",,"M, V, L",,53.954791029,27.628207941
702208,"г. Минск, ул. Асаналиева, 40/1",,"M, V, L","M, V, L",53.851083333,27.5455
702209,"г. Минск, ул. Калиновского, 66А",,"M, V, L",,53.939179953,27.650513869
702211,"г. Минск, ул. Плеханова, 91",,"M, V, L","M, V, L",53.86122098,27.603812149
702212,"г. Минск, ул. П.Глебки, 118",,"M, V, L","M, V, L",53.927669993,27.481921932
702216,"г. Минск, ул. Ангарская, 38",,"M, V, L","M, V, L",53.87125,27.684594444
702218,"г. Минск, ул. Кузьмы Чорного, 5",,"M, V, L","M, V, L",53.924227778,27.606338889
702219,"г. Минск, ул. Слободская, 9",,"M, V, L","M, V, L",53.862861111,27.430333333
702220,"г. Минск, ул. Ауэзова, 11",,"M, V, L","M, V, L",53.837583333,27.642944444
702221,"г. Минск, ул. Социалистическая, 2",,"M, V, L","M, V, L",53.856808333,27.657705556
702223,"г. Минск, ул. Матусевича 36/1",,"M, V, L","M, V, L",53.915431715,27.473736064
702224,"г. Минск, ул. Гурского, 30",,"M, V, L","M, V",53.883423977,27.48000202
702225,"г. Минск, ул. Притыцкого, 148",,"M, V, L","M, V, L",53.907863889,27.436947222
702226,"г. Минск, ул. Руссиянова, 17",,"M, V, L","M, V, L",53.935939025,27.68504
702227,"г. Минск, ул. Ваупшасова, 4",,"M, V, L","M, V, L",53.888158943,27.634814408
702228,"г. Минск, ул. Севастопольская, 121",,"M, V, L","M, V, L",53.941277778,27.610861111
702229,"г. Минск, ул. Макаенка, 17",,"M, V, L","M, V, L",53.917861111,27.628638889
702231,"г. Минск, ул. Кижеватова, 72/3",,"M, V, L","M, V, L",53.846789832,27.533442804
702232,"г. Минск, ул. Кижеватова, 58, БСМП",,"M, V, L","M, V, L",53.85204607,27.535310952
702234,"г. Минск, пр-т Рокоссовского, 44",,"M, V, L","M, V",53.866502778,27.591805556
702237,"г. Минск, пер. Кабушкина, 19а",,"M, V, L","M, V",53.867516667,27.643861111
702238,"г. Минск, ул. Сердича, 10",,"M, V, L",,53.911757992,27.489220909
702239,"г. Минск, ул. Серова, 22",,"M, V, L",,53.84162503,27.553982101
702240,"г. Минск, Долгиновский тракт, 39 ",,"M, V, L","M, V",53.937922222,27.543372222
702246,"г. Минск, ул. Матусевича, 37",,"M, V, L","M, V, L",53.917191667,27.450702778
702247,"г. Минск, ул. Охотская, 120",,"M, V, L","M, V, L",53.881147992,27.669044893
702248,"г. Минск, ул. Казинца, 21, к. 2",,"M, V, L","M, V, L",53.861924037,27.522153263
702249,"г. Минск, ул. Герасименко, 57",,"M, V, L","M, V, L",53.890333287,27.677111041
702251,"г. Минск, ул. В. Хоружей, д. 44",,"M, V, L",,53.92369438,27.55391656
702252,"г. Минск, ул. Сурганова, 47-5",,"M, V, L","M, V, L",53.9274,27.5851
702253,"г. Минск, пер. 3-й Можайский, 19",,"M, V, L",,53.943620081,27.580209084
702255,"г. Минск, ул. Притыцкого, д. 110",,"M, V, L",,53.90916947,27.44259987
702256,"г. Минск, ул. Уборевича, 81",,"M, V, L","M, V, L",53.83653058,27.652622435
702262,"г. Минск, ул. Хмаринская, 25",,"M, V, L","M, V, L",53.970889,27.583389
702266,"г. Минск, пр-т Независимости, 129, к. 1",,"M, V, L","M, V, L",53.935273722,27.643898076
702267,"г. д. Ждановичи, ул. Кольцевая, д. 19",,"M, V, L",,53.936399995,27.425969969
702268,"г. Минск, ул. Лидская, 12",,"M, V, L","M, V, L",53.921906756,27.432188428
702269,"г. Минск, р-н ул. Скрипникова, д. 4",,"M, V, L",,53.89023607,27.423016564
702270,"г. Минск, ул. Горецкого, д. 93",,"M, V, L",,53.89200001,27.43508334
702271,"г. Минск, ул. Пимена Панченко, 8 ",,"M, V, L","M, V, L",53.882627778,27.424405556
702272,"г. Минск, ул. Гурского, 23",,"M, V, L","M, V, L",53.879627734,27.490662156
702277,"г. Минск, ул. Октябрьская, 5",,"M, V, L","M, V, L",53.89368033,27.567503478
702278,"аг. Лесной, ул. Н.Н. Александрова, 15",,"M, V, L",,54.013027778,27.677972222
702281,"г. Минск, ул. Скрипникова, 43",,"M, V, L","M, V, L",53.898567066,27.422084099
702282,"г. Минск, ул. Скрипникова, 25",,"M, V, L","M, V, L",53.893394444,27.420952778
702283,"г. Минск, ул. Руссиянова, 6",,"M, V, L","M, V, L",53.942706916,27.686143903
702287,"г. Минск, ул. Якубова, 9",,"M, V, L","M, V",53.85808334,27.588750087
702293,"г. Минск, ул. Филатова, 13",,"M, V, L","M, V, L",53.869222222,27.632333333
702299,"г. Минск, ул. Шабаны, 16",,"M, V, L",,53.83541741,27.697877147
702300,д. Скураты,,"M, V, L",,54.018194444,27.971666667
702304,"н.п. Семеньковичи, Черневический с/с","V, L",,,54.08025,28.68980556
702305,н.п. Мачужичи,"M, V, L",,,54.12377778,27.93430556
702309,п. Октябрьский,,"M, V, L","M, V",54.041111111,28.200638889
702313,"аг. Озерцо, Щомыслицкий с/с, ул. Центральная, 29",,"M, V, L","M, V, L",53.840944444,27.392111111
702316,"г. Жодино, ул. Сухогрядская, 3/2",,"M, V, L",,54.085482962,28.30174088
702317,"аг. Колодищи, ул. Чкалова, 2",,"M, V, L","M, V, L",53.945555556,27.776694444
702320,"г. Минск, ул. Волгоградская, 35",,"M, V, L",,53.935669701,27.616401138
702324,"н.п. Ружамполь, ул. Центральная, 8Б","M, V, L",,,53.69936111,27.28375
702330,д. Рубилки,"M, V, L",,,53.69113889,27.41294444
702333,п. Сухорукие,,"M, V, L",,53.907861111,27.744277778
702334,д. Заболотье,,"M, V, L","M, V, L",53.777055556,27.921805556
702336,д. Старина,,"M, V, L",,53.94805556,27.84241667
702338,"д. Гатово, ул. Металлургическая, 16а",,"M, V, L","M, V, L",53.782883333,27.631508333
702339,"г. Минск, ул. Колесникова, 1",,"M, V, L","M, V, L",53.916912865,27.435853563
702340,"д. Цнянка, в/г 137А, д. 1",,"M, V, L","M, V",53.987416667,27.50625
702343,"н.п. Иваничи, Клинокский с/с","V, L",,,53.65972222,28.32333333
702345,"н.п. Правда, Руднянский с/с","M, V, L",,,53.82288889,28.40038889
702346,н.п. Рованичская Слобода,"V, L",,,53.91491667,28.57830556
702348,"н.п. Клетное, Дубровский с/с","V, L",,,53.33283333,28.08508333
702349,"н.п. Клетишино, Дубровский с/с","V, L",,,53.41283333,28.05875
702350,н.п. Подвилье,"M, V, L",,,53.49888889,27.99019444
702352,"н.п. Ржище, Новоселковский с/с","V, L",,,53.44386111,27.88186111
702353,н.п. Лещатка,"M, V, L",,,54.04327778,26.65433333
702357,"г. Воложин, ул. Комсомольская, 4",,"M, V, L",,54.091194444,26.52175
702358,н.п. Глинки,"M, V, L",,,53.34975,27.23672222
702359,"н.п. Юрковичи, Швабский с/с","M, V, L",,,54.28919444,28.03619444
702360,"н.п. Рабак, Козловичского с/с","V, L",,,52.99719444,27.867
702361,"г. Минск, ул. Основателей, 24",,"M, V, L","M, V",53.939666667,27.726472222
702362,"н.п. Еськовичи, Липский с/с","M, V, L",,,53.22241667,26.51580556
702364,н.п. Гостиловичи,"M, V, L",,,54.20177778,27.89930556
702365,"н.п. Хрост, Моисеевщинский с/с","V, L",,,54.45686111,28.65522222
702366,"г. Дзержинск, ул. Чкалова, 30",,"M, V, L","M, V, L",53.674725,27.124594444
702367,"г. Дзержинск, ул. Октябрьская, 72",,"M, V, L","M, V, L",53.692222222,27.124027778
702368,"г. Дзержинск, пл. Дзержинского, 1",,"M, V, L","M, V, L",53.685611111,27.131944444
702369,"г. Столбцы, ул. Ленинская, 85",,"M, V, L","M, V, L",53.487333333,26.745138889
702374,"н.п. Корень, Гайненский с/с","M, V, L",,,54.33722222,27.71941667
702375,"г. Логойск, ул. Советская, 1",,"M, V, L","M, V, L",54.203611111,27.853555556
702376,"н.п. Октябрь, Октябрьский с/с","M, V, L",,,54.42216667,27.74561111
702377,н.п. Белое,"V, L",,,54.459047402,27.596756309
702378,д. Тресковщина,,"M, V, L",,53.913416667,27.094111152
702379,"н.п. Боровиковщина, Пряльницкий с/с","V, L",,,53.960833333,26.723305555
702383,"д. Боровляны, ул. 40 лет Победы, д.13",,"M, V, L","M, V, L",53.994083333,27.67325
702384,"г. Смолевичи, ул. Комсомольская",,"M, V, L","M, V, L",54.039247222,28.086097222
702387,"н.п. Углы, Ивенецкий с/с","V, L",,,53.91811111,26.63119444
702388,"н.п. Вязынь, Вязынский с/с","M, V, L",,,54.42652778,27.15322222
702389,н.п. Ольковичи,"V, L",,,54.49355556,27.43197222
702390,"н.п. Сосновщина, Долгиновский с/с","M, V, L",,,54.63030556,27.43372222
702391,"н.п. Микулино, Долгиновский с/с","V, L",,,54.69913889,27.46480556
702393,н.п. Поня,"V, L",,,54.75279444,27.64737778
702395,"г. Мядель, ул. Юбилейная, 19",,"M, V, L",,54.869027778,26.933972222
702396,"н.п. Студеница, Слободской с/с","V, L",,,54.90991667,27.027
702397,"н.п. Слобода, Слободской с/с","V, L",,,54.94236111,27.18861111
702402,"г. Марьина Горка, ул. Чапаева, 3",,"M, V, L","M, V, L",53.514747222,28.131980556
702416,"н.п. Грицевичи, Грицевичский с/с","M, V, L",,,52.97677778,26.71772222
702417,"г. Слуцк, пер. 4-й Новый, 1",,"M, V, L","M, V, L",53.009447222,27.525047222
702418,"г. Солигорск, ул. Богомолова, 22А",,"M, V, L","M, V",52.787252778,27.506252778
702420,"г. Слуцк, ул. Копыльская, 57",,"M, V, L","M, V, L",53.029856695,27.537144781
702421,"г. Слуцк, ул. Гагарина, 3",,"M, V, L","M, V, L",53.038086111,27.590386111
702423,"г. Слуцк, ул. Ленина, 207",,"M, V, L","M, V, L",53.032897222,27.559097222
702424,"г. Солигорск, ул. Любанское шоссе, 5-км",,"M, V, L","M, V",52.811583333,27.564472222
702425,"г. Солигорск, ул. Коржа, 1",,"M, V, L","M, V, L",52.778038889,27.534605556
702429,"г. Солигорск, ул. Максима Горького, 13",,"M, V, L","M, V, L",52.789833333,27.548166667
702431,"г. Солигорск, ул. Ленина, 12",,"M, V, L","M, V, L",52.786386111,27.533705556
702432,"г. Солигорск, ул. Козлова, 51",,"M, V, L","M, V, L",52.783347222,27.547558333
702433,"г. Солигорск, ул. Ленина, 57",,"M, V, L",,52.778916618,27.547444444
702434,"г. Солигорск, ул. Строителей, 32а",,"M, V, L","M, V",52.793972222,27.536111111
702442,"г. Марьина Горка, ул. Новая Заря, 15а",,"M, V, L",,53.502290195,28.170433
702443,"г. Клецк, ул. Кирова, 1",,"M, V, L","M, V",53.070277778,26.653888889
702446,"г. Вилейка, ул. Л. Толстого, 47",,"M, V, L","M, V",54.480333333,26.896638889
702469,"н.п. Жилин Брод, Первомайский с/с, Р91","V, L",,,53.21141667,27.76216667
702502,"г. Борисов, ул. Демина, 11",,"M, V, L",,54.19195,28.502194444
702503,"г. Борисов, ул. III Интернационала, 79",,"M, V, L","M, V, L",54.247555556,28.505805556
702505,н.п. Калюжки,"M, V, L","M, V, L",,54.11483333,28.24666667
702506,"г. Смолевичи, ул. 50 лет Октября, 11",,"M, V, L","M, V, L",54.026666667,28.0975
702507,"г. Жодино, пр-т Ленина, 22",,"M, V, L","M, V, L",54.097583333,28.305722222
702509,"г. Жодино, ул. Советская, 6",,"M, V, L",,54.105944373,28.356694542
702510,"г. Борисов, ул. Максима Горького, 135",,"M, V, L","M, V, L",54.217916667,28.493111111
702530,н.п. Камено,"V, L",,,54.41747222,28.0195
702601,"н.п. Большая Ухолода, Метченский с/с","M, V, L",,,54.20725,28.61269444
702602,"н.п. Липки, Неманицкий с/с","M, V, L",,,54.26566667,28.65513889
702605,"д. Острово, Начский с/с","V, L",,,54.41744444,29.08677778
702622,"г. Червень, ул. Горбачева, 15",,"M, V, L","M, V, L",53.709527778,28.432555556
702624,"н.п. Гореничи, Капланецкий с/с","M, V, L",,,53.78847222,28.99694444
702748,"г. Столбцы, ул. Гайдука, 20",,"M, V, L","M, V, L",53.484194444,26.734861111
702760,"г. Несвиж, ул. Гейсика, 1",,"M, V, L","M, V, L",53.222922222,26.681930556
702762,"н.п. Городея, ул. Вокзальная, 9","M, V, L",,,53.31436111,26.54011111
702766,"г. Дзержинск, ул. 1-я Ленинская, 43(47)",,"M, V, L","M, V, L",53.687833333,27.146833333
702880,"г. Вилейка, ул. Волынца, 7",,"M, V, L",,54.505,26.922222222
702881,"г. Молодечно, ул. Скорыны, 19",,"M, V, L","M, V, L",54.298475,26.848886111
702884,"г. Молодечно, ул. Великий гостинец, 40",,"M, V, L","M, V, L",54.308611111,26.822833333
702885,"г. Молодечно, ул. Волынца, 1",,"M, V, L","M, V, L",54.308333333,26.853888889
702888,"г. Вилейка, ул. Чапаева, 26",,"M, V, L","M, V, L",54.484891667,26.893955556
702891,"г. Заславль, Микрорайон 1-3",,"M, V, L","M, V, L",54.009555556,27.26925
703011,"г. Минск, ТЦ &quot;Столица&quot;",,"M, V, L",,53.895151389,27.546503722
704001,"г. Минск, ул. Каменногорская, в районе дома 33",,"M, V, L","M, V, L",53.915359134,27.415455424
704002,"г. Минск, ул. Неманская,  в р-не д. 21-35",,"M, V, L","M, V, L",53.913996031,27.427107336
704003,"г. Минск, ул. Н.Орды, 30",,"M, V, L","M, V",53.8457,27.487872222
704004,"г. Минск, ул. Неманская, д. 76",,"M, V, L",,53.925952222,27.431494444
704006,"г. Минск, пр-т Незавимости, в р-не д. 180, 182",,"M, V, L","M, V, L",53.944895511,27.693885374
704008,"г. Минск, ул. Восточная, в р-не д. 42, 48",,"M, V, L",,53.936648239,27.596703775
704012,"г. Борисов, ул. Чаловской, 17а",,"M, V, L","M, V, L",54.230530556,28.486169444
704013,"г. Минск, ул. Связистов, 6",,"M, V, L","M, V, L",53.912730507,27.673971061
704024,"г. Минск, пр. Каролинский, 5",,"M, V, L","M, V, L",53.857088765,27.488676752
704028,"г. Минск, пр-т Пушкина, 24",,"M, V, L","M, V, L",53.902556358,27.497249707
704036,"г. Минск, пр. Партизанский, 81",,"M, V, L","M, V, L",53.876063915,27.627969221
704037,"г. Минск, пр-т Независимости, 65/6",,"M, V, L","M, V, L",53.92060498,27.591084959
704038,"г. Минск, ул. Слободская, д. 37",,"M, V, L",,53.856118259,27.432915564
704041,п. Октябрьский,,"M, V, L",,54.04875,28.201416667
704044,"г. Минск, Логойский тракт, 22а, к. 1",,"M, V, L","M, V, L",53.947002275,27.615553433
704046,"г. Минск, ул. 3-я Щорса, 9",,"M, V, L","M, V, L",53.883500955,27.511857137
704052,"г. Минск, ул. Громова, д. 44, 46",,"M, V, L",,53.851900276,27.4411784
704054,"г. Минск, ул. Сухаревская, 28a",,"M, V, L","M, V, L",53.888354722,27.434372778
704063,"г. Минск, ул. Одинцова, 105a",,"M, V, L","M, V",53.899505556,27.429125
704066,"г. Минск, ул. Короля, 2",,"M, V, L","M, V, L",53.900883112,27.546819941
704068,"г. Минск, ул. Толбухина, 3",,"M, V, L",,53.925663781,27.612746822
704069,"г. Минск, ул. Я.Мавра, 3Б",,"M, V, L",,53.904691342,27.490812852
704070,"г. Минск, ул. Хоружей, 6б",,"M, V, L","M, V, L",53.919216533,27.57997194
704071,"г. Минск, ул. Седых, д.14г",,"M, V, L",,53.950455559,27.62340104
704078,"г. Минск, тер. Национальный аэропорт «Минск», 14",,"M, V, L","M, V",53.886275712,28.049394255
704081,"г. Минск, ул. Рафиева, д. 74",,"M, V, L",,53.861758339,27.438714756
704083,"г. Минск, пр-т Рокоссовского, 4/3",,"M, V, L",,53.872905088,27.59208974
704090,"г. Минск, ул. Нестерова, д.53 к1",,"M, V, L",,53.886521964,27.686650995
704094,"г. Минск, ул. Маяковского, р-н д. 100",,"M, V, L","M, V, L",53.87373361,27.568250443
704095,"г. Минск, ул. Кульман, д. 37",,"M, V, L",,53.926171389,27.564042222
704098,"г. Минск, пр-т Рокоссовского,  в районе дома 114",,"M, V, L",,53.859033333,27.608166667
704106,д. Городище,,"M, V, L",,53.979388906,27.837277978
704110,"Минск, Западный промузел ТЭЦ-4",,"M, V, L","M, V, L",53.874468459,27.416883114
704115,"г. Минск, ул. Железнодорожная, 23/15",,"M, V, L",,53.874888889,27.505669444
704118,"г. Минск, ул. Машерова, 78",,"M, V, L","M, V",53.91261836,27.532549734
704119,"г. Минск, ул. Машиностроителей, 28/2-13",,"M, V, L","M, V, L",53.850739502,27.662450454
704122,"г. Минск, ул. Ванеева, д. 40",,"M, V, L","M, V, L",53.876032864,27.591502076
704125,"д. Боровляны, ул. 40 лет Победы, 23",,"M, V, L","M, V, L",53.989391667,27.677563889
704126,"трасса М2, г. Минск, Национальный аэропорт «Минск»",,"M, V, L",,53.9701,27.7521
704128,"г. Минск, ул. Н.Орды, д. 11",,"M, V, L","M, V, L",53.842892553,27.479220202
704136,"г. Минск, ул. Фрунзе, 19",,"M, V, L",,53.903321896,27.578398143
704137,"Минская обл., Смолевичский р-н, М2-2 а.д. М1/Е30 Брест-Минск-гр. РФ 388 км",,"M, V, L",,53.945777778,27.980472222
704141,"г. Минск, ул. Кирова д.18",,"M, V, L","M, V, L",53.89933679,27.565773733
704143,"г. д. Колодищи, ул. Минская, д. 67",,"M, V, L",,53.94919,27.76167
704150,"г. Минск, ул. Ташкентская, 15",,"M, V, L","M, V, L",53.84056,27.62953
704152,"г.Минск, Радужная, 27",,"M, L",,53.934732,27.493586
704155,"г. Минск, ул. Кирова, 49",,,"M, V",53.900897,27.567686
704170,"г. Минск, ул. Неманская, 37",,"M, V, L","M, V, L",53.914566286,27.423637342
704174,"трасса М2, г. Минск, Национальный аэропорт «Минск»",,"M, V, L",,54.0028,27.8372
704175,"Минская  обл., Смолевичский р-н, вдоль автодороги М2-Национальный аэропорт «Минск», 27,9 км",,"M, V, L",,53.999,27.9142
704178,"г. Минск, ул. Руссиянова, д. 9",,"M, V, L","M, V, L",53.938589519,27.684365879
704179,"г. Минск, ул. Якубова, д. 14",,"M, V, L","M, V, L",53.852291743,27.597759706
704180,"г. Минск, пр-т Любимова, в районе дома №41",,"M, V, L","M, V, L",53.863781021,27.454509872
704181,"г. Молодечно, ул. Т. Дудко, 14",,"M, V, L","M, V",54.29894403,26.887182859
704182,"Минская обл., Смолевичский р-н",,"M, V, L",,53.92,27.9924
704188,"г. Минск, ул. Янковского, 35",,"M, V, L","M, V, L",53.88002222,27.451186111
704189,"г. Минск, ул. Неманская, 75",,"M, V, L","M, V, L",53.925191208,27.42812365
704190,"г. Минск, ул. Налибокская, 28",,"M, V, L","M, V, L",53.930745368,27.433811546
704198,"г. Минск, ул. Бурдейного, 53",,"M, V, L","M, V",53.903517883,27.437890778
704200,"г. Минск, ул. Притыцкого, д. 105,109",,"M, V, L","M, V, L",53.907222411,27.42845711
704207,"г. Минск, ул. Каменногорская,  в р-не д. №86 и №96",,"M, V, L","M, V, L",53.930833458,27.4258925
704209,"г. Минск, ул. Налибокская, д. 31, 37",,"M, V, L",,53.927851111,27.429213333
704211,"г. Минск, пересечение пр. Независимости и ул. Фогеля",,"M, V, L",,53.961614968,27.733853071
704213,"Новодворский с/с, 40/1, р-н д. Большое Стиклево",,"M, V, L",,53.86161092,27.684667053
704215,"г. Минск, ул. Независимости, 96а",,"M, V, L","M, V",53.928021754,27.629065019
704216,"г. Минск, пр-т Победителей, д. 49",,"M, V, L",,53.91720784,27.53316416
704218,"г. Минск, пр-т Победителей - пер. Веснинка",,"M, V, L","M, V",53.940197222,27.471136111
704221,"г. Минск, ул. Слободская, 2",,"M, V, L","M, V",53.8674,27.425425
704222,д. Сенница,,"M, V, L","M, V, L",53.821472222,27.530777778
704223,"г. Минск, МКАД, поворот на Семково",,"M, V, L",,53.965881,27.469329892
704238,"г. Минск, тракт Долгиновский д. 188",,"M, V, L","M, V",53.96925,27.543094
704239,"г. Минск, ул. Одинцова, 47",,"M, V, L",,53.897017941,27.442260011
704250,"г. Минск, 2-й пер.Тимошенко, 5",,"M, V, L","M, V, L",53.89565,27.46032
704251,"г. Минск, ул. Московская, 22",,"M, V, L","M, V, L",53.886363276,27.537086195
704263,"г. Минск, ул. Ташкентская 19",,,"M, V",53.844002,27.628901
704266, д. Староселье,"M, V, L",,,52.89080556,26.72158333
704268,"н.п. Рабунь, Кривосельский с/с","V, L",,,54.50845,27.15185833
704273,"г. Минск, ул. Чечота, в р-не 42, 44",,"M, V, L","M, V, L",53.847308734,27.485218271
704274,"г. Минск, ул. Победителей 20",,,"M, V",53.93279,27.51088
704276,"г. Минск, ул. Чечота, д. 7",,"M, V, L",,53.849006484,27.478541961
704277,"г. Минск, ул. Каролинская, д. 14",,"M, V, L",,53.853105026,27.492473134
704278,"г. Минск, ул. Ежи Гедройца, в р-не д.14,18",,"M, V, L","M, V, L",53.852380134,27.480336643
704283,"г. Минск, ул. Кошевого, 30",,"M, V, L","M, V, L",53.88423616,27.602395485
704284,"н.п. Гребенец, Червенский с/с","V, L",,,53.61216667,28.49324444
704285,д. Богатырёво,,"M, V, L","M, V, L",53.844444444,27.409161111
704286,"г. Минск, ул. Золотая, 9",,"M, V, L",,53.94070833,27.48893333
704287,"г. Минск, пр-т Независимости, д. 47",,"M, V, L","M, V, L",53.913777,27.580154
704291,"г. Минск, в районе д.№3 к.4 и д.№3 к.5 по ул. Космонавтов",,"M, V, L","M, V, L",53.851614888,27.473475161
704292,"г. Минск, ул. Слободская, 167, 177",,"M, V, L","M, V, L",53.846226798,27.467516652
704293,"г. Минск, ул. Шпилевского , д. 57, 59",,"M, V, L","M, V, L",53.845894661,27.56313047
704295,"г. Минск, ул. Игнатенко, д. 7",,"M, V, L",,53.917600316,27.52402701
704296,"г. Минск, ул. Рафиева / Голубева , д. 9 / 26-2",,"M, V, L",,53.869338287,27.466015417
704300,"г. Минск, ул. Рафиева, д. 89а",,"M, V, L","M, V, L",53.859378376,27.440594793
